title,link
FM Dar says ‘Greater Israel’ plan a direct threat to regional peace,https://www.dawn.com/news/1937098/fm-dar-says-greater-israel-plan-a-direct-threat-to-regional-peace
"Musk’s xAI sues Apple, OpenAI alleging antitrust violations",https://www.dawn.com/news/1937160/musks-xai-sues-apple-openai-alleging-antitrust-violations
Indian spin great Ashwin calls time on IPL career,https://www.dawn.com/news/1937574/indian-spin-great-ashwin-calls-time-on-ipl-career
"Indian cabinet approves 2030 Commonwealth Games bid, names Ahmedabad as ‘ideal host city’",https://www.dawn.com/news/1937625/indian-cabinet-approves-2030-commonwealth-games-bid-names-ahmedabad-as-ideal-host-city
Pakistan through to ATF team competition quarterfinals after defeating Uzbekistan,https://www.dawn.com/news/1937627/pakistan-through-to-atf-team-competition-quarterfinals-after-defeating-uzbekistan
"New Zealand rugby player Shane Christie, who suffered multiple concussions, dies aged 39",https://www.dawn.com/news/1937618/new-zealand-rugby-player-shane-christie-who-suffered-multiple-concussions-dies-aged-39
Indian football federation faces FIFA ban for second time in three years,https://www.dawn.com/news/1937564/indian-football-federation-faces-fifa-ban-for-second-time-in-three-years
PCB officials concerned over national team’s continued decline,https://www.dawn.com/news/1937470/pcb-officials-concerned-over-national-teams-continued-decline
"Swiatek, Sinner cruise as expanded US Open serves up tennis feast",https://www.dawn.com/news/1937550/swiatek-sinner-cruise-as-expanded-us-open-serves-up-tennis-feast
Leverkusen sign former Real defender Vazquez,https://www.dawn.com/news/1937473/leverkusen-sign-former-real-defender-vazquez
"Tokyo-bound Duplantis, Lyles headline Diamond League finals",https://www.dawn.com/news/1937469/tokyo-bound-duplantis-lyles-headline-diamond-league-finals
New Zealand fast bowler Will O’Rourke out for three months as injuries mount,https://www.dawn.com/news/1937378/new-zealand-fast-bowler-will-orourke-out-for-three-months-as-injuries-mount
Alcaraz amused by reaction to his accidental buzz cut by brother mishandling clippers,https://www.dawn.com/news/1937380/alcaraz-amused-by-reaction-to-his-accidental-buzz-cut-by-brother-mishandling-clippers
Ngumoha in dream Premier League debut with late winner for Liverpool at Newcastle,https://www.dawn.com/news/1937337/ngumoha-in-dream-premier-league-debut-with-late-winner-for-liverpool-at-newcastle
Venus Williams bows out of US Open as streamlined Alcaraz sails through,https://www.dawn.com/news/1937323/venus-williams-bows-out-of-us-open-as-streamlined-alcaraz-sails-through
Govt agrees to release Rs250m for Pakistan’s participation in FIH Pro League,https://www.dawn.com/news/1937271
Rizwan edges Egypt’s Adham in split decision to cap Pakistan Open MMA,https://www.dawn.com/news/1937261/rizwan-edges-egypts-adham-in-split-decision-to-cap-pakistan-open-mma
BCCI ends $43.6m sponsorship after online gambling ban,https://www.dawn.com/news/1937270/bcci-ends-436m-sponsorship-after-online-gambling-ban
"Sinner starts title defence at US Open, Swiatek and Gauff in action",https://www.dawn.com/news/1937172/sinner-starts-title-defence-at-us-open-swiatek-and-gauff-in-action
Fatima Sana to lead women’s side as PCB announces 15-member squad for ICC World Cup,https://www.dawn.com/news/1937081/fatima-sana-to-lead-womens-side-as-pcb-announces-15-member-squad-for-icc-world-cup
"Sabalenka, Djokovic win before Medvedev tirade sparks chaos at US Open",https://www.dawn.com/news/1937108/sabalenka-djokovic-win-before-medvedev-tirade-sparks-chaos-at-us-open
"Afghanistan name spin-heavy T20 squad for tri-series, Asia Cup",https://www.dawn.com/news/1937018/afghanistan-name-spin-heavy-t20-squad-for-tri-series-asia-cup
Pakistan Weightlifting Federation’s bank account blocked over lack of transparency,https://www.dawn.com/news/1937023/pakistan-weightlifting-federations-bank-account-blocked-over-lack-of-transparency
Raducanu cruises to first US Open win since 2021 triumph,https://www.dawn.com/news/1936912/raducanu-cruises-to-first-us-open-win-since-2021-triumph
"Man Utd still winless after Fulham draw, Everton win to open new stadium",https://www.dawn.com/news/1936910/man-utd-still-winless-after-fulham-draw-everton-win-to-open-new-stadium
"Rayan, Azlan headline Pakistan’s performance at junior swim worlds with new national records",https://www.dawn.com/news/1936900/rayan-azlan-headline-pakistans-performance-at-junior-swim-worlds-with-new-national-records
Three tons as record-breaking Australia crush South Africa in 3rd ODI consolation win,https://www.dawn.com/news/1936899/three-tons-as-record-breaking-australia-crush-south-africa-in-3rd-odi-consolation-win
Indian batsman Cheteshwar Pujara calls time on illustrious career,https://www.dawn.com/news/1936878/indian-batsman-cheteshwar-pujara-calls-time-on-illustrious-career
"Rizwan ‘The Haider’ eyes history, predicts knockout win at Pakistan Open MMA Championship",https://www.dawn.com/news/1936511
Pakistan Open MMA Championship set for thrilling finals,https://www.dawn.com/news/1936513/pakistan-open-mma-championship-set-for-thrilling-finals
Ruiz goal gives rusty PSG narrow victory over Angers,https://www.dawn.com/news/1936514/ruiz-goal-gives-rusty-psg-narrow-victory-over-angers
"Man City revamp rocked by Spurs, Villa beaten at Brentford",https://www.dawn.com/news/1936079/man-city-revamp-rocked-by-spurs-villa-beaten-at-brentford
"Any talks with India will be on equal footing, no begging for negotiations: PCB chief Mohsin Naqvi",https://www.dawn.com/news/1935792/any-talks-with-india-will-be-on-equal-footing-no-begging-for-negotiations-pcb-chief-mohsin-naqvi
Trump says 2026 FIFA World Cup draw set for December in Washington,https://www.dawn.com/news/1935586/trump-says-2026-fifa-world-cup-draw-set-for-december-in-washington
National mix set for Pakistan Open MMA semi-finals,https://www.dawn.com/news/1934655/national-mix-set-for-pakistan-open-mma-semi-finals
"Shaheen Afridi backs youngsters following Babar, Rizwan axe",https://www.dawn.com/news/1934669/shaheen-afridi-backs-youngsters-following-babar-rizwan-axe
Pakistan MMA chief aims to build nation’s ‘next major sports property’,https://www.dawn.com/news/1934661/pakistan-mma-chief-aims-to-build-nations-next-major-sports-property
"Heavy rains hit Himalayas, spread havoc in India and Pakistan",https://www.dawn.com/news/1937593/heavy-rains-hit-himalayas-spread-havoc-in-india-and-pakistan
"Pakistan’s monsoon misery: Nature’s fury, man’s mistake",https://www.dawn.com/news/1937554/pakistans-monsoon-misery-natures-fury-mans-mistake
Welcome to Quetta — from ‘Little London’ to just another city choking on its own waste,https://www.dawn.com/news/1930401/welcome-to-quetta-from-little-london-to-just-another-city-choking-on-its-own-waste
Crime comedy series Deli Boys renewed for second season at Hulu,https://images.dawn.com/news/1194055/crime-comedy-series-deli-boys-renewed-for-second-season-at-hulu
Spread of poverty and vulnerability is the outcome of deliberate public policy,https://www.dawn.com/news/1937498/the-shame-of-inaction
Climate priorities,https://www.dawn.com/news/1937283/climate-priorities
Enigmatic ties?,https://www.dawn.com/news/1937281/enigmatic-ties
Like a fearless Rachel Corrie,https://www.dawn.com/news/1937282/like-a-fearless-rachel-corrie
Solar revolution,https://www.dawn.com/news/1937280/solar-revolution
Beyond the short-term,https://www.dawn.com/news/1937055/beyond-the-short-term
King Dollar,https://www.dawn.com/news/1937054/king-dollar
